{
  "$schema": "https://json-schema.org/draft/2020-12/schema",
  "title": "Conversation State",
  "description": "Optional durable conversation state for pasted workplace context.",
  "type": "object",
  "additionalProperties": false,
  "required": [
    "source_scope",
    "facts",
    "assumptions",
    "open_questions",
    "decisions",
    "actions",
    "risks",
    "suggested_next_response"
  ],
  "properties": {
    "source_scope": {
      "type": "object",
      "additionalProperties": false,
      "required": [
        "sources_reviewed",
        "known_limitations",
        "source_gaps"
      ],
      "properties": {
        "sources_reviewed": {
          "type": "array",
          "minItems": 1,
          "items": {
            "type": "string",
            "minLength": 1
          }
        },
        "known_limitations": {
          "type": "array",
          "items": {
            "type": "string",
            "minLength": 1
          }
        },
        "source_gaps": {
          "type": "array",
          "minItems": 1,
          "items": {
            "type": "string",
            "minLength": 1
          }
        }
      }
    },
    "facts": {
      "type": "array",
      "items": {
        "type": "object",
        "additionalProperties": false,
        "required": [
          "id",
          "text",
          "source_anchor",
          "confidence"
        ],
        "properties": {
          "id": {
            "type": "string",
            "minLength": 1
          },
          "text": {
            "type": "string",
            "minLength": 1
          },
          "source_anchor": {
            "type": "string",
            "minLength": 1
          },
          "confidence": {
            "type": "string",
            "enum": [
              "high",
              "medium",
              "low"
            ]
          },
          "owner": {
            "type": "string",
            "minLength": 1
          },
          "due_or_timing": {
            "type": "string",
            "minLength": 1
          },
          "status": {
            "type": "string",
            "minLength": 1
          },
          "note": {
            "type": "string",
            "minLength": 1
          },
          "evidence_needed": {
            "type": "string",
            "minLength": 1
          }
        }
      }
    },
    "assumptions": {
      "type": "array",
      "items": {
        "type": "object",
        "additionalProperties": false,
        "required": [
          "id",
          "text",
          "source_anchor",
          "confidence"
        ],
        "properties": {
          "id": {
            "type": "string",
            "minLength": 1
          },
          "text": {
            "type": "string",
            "minLength": 1
          },
          "source_anchor": {
            "type": "string",
            "minLength": 1
          },
          "confidence": {
            "type": "string",
            "enum": [
              "high",
              "medium",
              "low"
            ]
          },
          "note": {
            "type": "string",
            "minLength": 1
          }
        }
      }
    },
    "open_questions": {
      "type": "array",
      "items": {
        "type": "object",
        "additionalProperties": false,
        "required": [
          "id",
          "text",
          "source_anchor",
          "confidence"
        ],
        "properties": {
          "id": {
            "type": "string",
            "minLength": 1
          },
          "text": {
            "type": "string",
            "minLength": 1
          },
          "source_anchor": {
            "type": "string",
            "minLength": 1
          },
          "confidence": {
            "type": "string",
            "enum": [
              "high",
              "medium",
              "low"
            ]
          },
          "owner": {
            "type": "string",
            "minLength": 1
          },
          "note": {
            "type": "string",
            "minLength": 1
          }
        }
      }
    },
    "decisions": {
      "type": "array",
      "items": {
        "type": "object",
        "additionalProperties": false,
        "required": [
          "id",
          "text",
          "source_anchor",
          "confidence"
        ],
        "properties": {
          "id": {
            "type": "string",
            "minLength": 1
          },
          "text": {
            "type": "string",
            "minLength": 1
          },
          "source_anchor": {
            "type": "string",
            "minLength": 1
          },
          "confidence": {
            "type": "string",
            "enum": [
              "high",
              "medium",
              "low"
            ]
          },
          "status": {
            "type": "string",
            "minLength": 1
          }
        }
      }
    },
    "actions": {
      "type": "array",
      "items": {
        "type": "object",
        "additionalProperties": false,
        "required": [
          "id",
          "text",
          "source_anchor",
          "confidence"
        ],
        "properties": {
          "id": {
            "type": "string",
            "minLength": 1
          },
          "text": {
            "type": "string",
            "minLength": 1
          },
          "source_anchor": {
            "type": "string",
            "minLength": 1
          },
          "confidence": {
            "type": "string",
            "enum": [
              "high",
              "medium",
              "low"
            ]
          },
          "owner": {
            "type": "string",
            "minLength": 1
          },
          "due_or_timing": {
            "type": "string",
            "minLength": 1
          },
          "status": {
            "type": "string",
            "minLength": 1
          },
          "note": {
            "type": "string",
            "minLength": 1
          }
        }
      }
    },
    "risks": {
      "type": "array",
      "items": {
        "type": "object",
        "additionalProperties": false,
        "required": [
          "id",
          "text",
          "source_anchor",
          "confidence"
        ],
        "properties": {
          "id": {
            "type": "string",
            "minLength": 1
          },
          "text": {
            "type": "string",
            "minLength": 1
          },
          "source_anchor": {
            "type": "string",
            "minLength": 1
          },
          "confidence": {
            "type": "string",
            "enum": [
              "high",
              "medium",
              "low"
            ]
          },
          "note": {
            "type": "string",
            "minLength": 1
          }
        }
      }
    },
    "unsupported_claims": {
      "type": "array",
      "items": {
        "type": "object",
        "additionalProperties": false,
        "required": [
          "id",
          "text",
          "source_anchor",
          "confidence"
        ],
        "properties": {
          "id": {
            "type": "string",
            "minLength": 1
          },
          "text": {
            "type": "string",
            "minLength": 1
          },
          "source_anchor": {
            "type": "string",
            "minLength": 1
          },
          "confidence": {
            "type": "string",
            "enum": [
              "high",
              "medium",
              "low"
            ]
          },
          "evidence_needed": {
            "type": "string",
            "minLength": 1
          },
          "note": {
            "type": "string",
            "minLength": 1
          }
        }
      }
    },
    "suggested_next_response": {
      "type": [
        "string",
        "null"
      ]
    }
  }
}
